{"contract":"instrument-spec-versions","schemaVersion":2,"requestId":"request-synthetic","asOf":"2026-10-14T08:00:00+00:00","data":{"items":[{"specVersionId":"spec-synthetic","instrumentId":"instrument-synthetic","versionNumber":1,"multiplier":"1","quantityUnit":"underlying","tickSize":"0.01","lotSize":"0.001","minQuantity":"0.001","priceAssetId":"asset-usdt-synthetic","payoffAssetId":"asset-usdt-synthetic","valuationModel":"linear_quote","effectiveFromUtc":"2026-10-14T08:00:00+00:00","effectiveToUtc":null,"recordedAtUtc":"2026-10-14T08:00:00+00:00","source":"synthetic-fixture","sourceVersion":"fixture-v1","contentHash":"aaaaaaaaaaaaaaaaaaaaaaaaaaaaaaaaaaaaaaaaaaaaaaaaaaaaaaaaaaaaaaaa","sourceObservedAtUtc":"2026-10-14T08:00:00+00:00"}]}}
